{
  "$schema": "../../schema/ruleset.schema.json",
  "id": "draft-3p",
  "name": "Draft 3-Player Dragon Mode (experimental)",
  "version": "0.2.0",
  "status": "deprecated",
  "players": 3,
  "description": "The owner's 3-player Dragon mode rules, draft v0.2 (docs/RULES.md). Plays every 3-player parameter at its default. Experimental until bot self-play shows the seats are balanced.",
  "overrides": {},
  "notes": "Kept without a lock: it was never a Candidate or Official, so it does not replay."
}
