{
  "$schema": "../schema/ruleset.schema.json",
  "id": "standard-3p",
  "name": "Standard (3-player)",
  "version": "0.2.0",
  "status": "experimental",
  "players": 3,
  "description": "The default 3-player game (D63): the full Dragon rules of Good Practice, except the King moves one square in any direction, as in the 2-player Standard (decision 0016). Each Coast piece's first way off the Coast is through A5 (coast.3p.exit, built in S68, decision 0019). Experimental until bot self-play shows the seats are balanced.",
  "overrides": {
    "king.range": 1
  }
}
